{
  "edges": [
    {
      "document_indices": [
        52
      ],
      "observed_ranks": [
        3
      ],
      "occurrence_count": 1,
      "recommended_track_id": "62b3841f592411e1bbf4ff22",
      "seed_track_id": "62b38083592411bbc1f4cc51"
    },
    {
      "document_indices": [
        52
      ],
      "observed_ranks": [
        5
      ],
      "occurrence_count": 1,
      "recommended_track_id": "65316386bab2d63bd119e2c2",
      "seed_track_id": "62b38083592411bbc1f4cc51"
    },
    {
      "document_indices": [
        52
      ],
      "observed_ranks": [
        1
      ],
      "occurrence_count": 1,
      "recommended_track_id": "665a227e4dfb90cc19dcd9df",
      "seed_track_id": "62b38083592411bbc1f4cc51"
    },
    {
      "document_indices": [
        52
      ],
      "observed_ranks": [
        2
      ],
      "occurrence_count": 1,
      "recommended_track_id": "6875503b3b891fead18ab720",
      "seed_track_id": "62b38083592411bbc1f4cc51"
    },
    {
      "document_indices": [
        52
      ],
      "observed_ranks": [
        4
      ],
      "occurrence_count": 1,
      "recommended_track_id": "694059e076a1c1f80ff93a7f",
      "seed_track_id": "62b38083592411bbc1f4cc51"
    },
    {
      "document_indices": [
        41
      ],
      "observed_ranks": [
        3
      ],
      "occurrence_count": 1,
      "recommended_track_id": "62b38a78592411cd6df54506",
      "seed_track_id": "62b380ed5924110336f4d7ef"
    },
    {
      "document_indices": [
        41
      ],
      "observed_ranks": [
        4
      ],
      "occurrence_count": 1,
      "recommended_track_id": "65c690671bf8f200086e0cb7",
      "seed_track_id": "62b380ed5924110336f4d7ef"
    },
    {
      "document_indices": [
        41
      ],
      "observed_ranks": [
        2
      ],
      "occurrence_count": 1,
      "recommended_track_id": "665a22614dfb90cc19dcd94e",
      "seed_track_id": "62b380ed5924110336f4d7ef"
    },
    {
      "document_indices": [
        41
      ],
      "observed_ranks": [
        5
      ],
      "occurrence_count": 1,
      "recommended_track_id": "66918b62de19d0f1c74ea666",
      "seed_track_id": "62b380ed5924110336f4d7ef"
    },
    {
      "document_indices": [
        41
      ],
      "observed_ranks": [
        1
      ],
      "occurrence_count": 1,
      "recommended_track_id": "67aa5ba255e93dd3436923e2",
      "seed_track_id": "62b380ed5924110336f4d7ef"
    },
    {
      "document_indices": [
        48
      ],
      "observed_ranks": [
        5
      ],
      "occurrence_count": 1,
      "recommended_track_id": "65b3fafccdef020008e0c12a",
      "seed_track_id": "62b388df592411d002f52c48"
    },
    {
      "document_indices": [
        48
      ],
      "observed_ranks": [
        1
      ],
      "occurrence_count": 1,
      "recommended_track_id": "65eb6a6263853a000a15a02a",
      "seed_track_id": "62b388df592411d002f52c48"
    },
    {
      "document_indices": [
        48
      ],
      "observed_ranks": [
        2
      ],
      "occurrence_count": 1,
      "recommended_track_id": "66477a0b30b208e2323ed71f",
      "seed_track_id": "62b388df592411d002f52c48"
    },
    {
      "document_indices": [
        48
      ],
      "observed_ranks": [
        3
      ],
      "occurrence_count": 1,
      "recommended_track_id": "67855b07f76968728486aa62",
      "seed_track_id": "62b388df592411d002f52c48"
    },
    {
      "document_indices": [
        48
      ],
      "observed_ranks": [
        4
      ],
      "occurrence_count": 1,
      "recommended_track_id": "682b57028ab5a645af4842d4",
      "seed_track_id": "62b388df592411d002f52c48"
    },
    {
      "document_indices": [
        45
      ],
      "observed_ranks": [
        4
      ],
      "occurrence_count": 1,
      "recommended_track_id": "62b38944592411349ff531a7",
      "seed_track_id": "67a10f7003677edafb63f452"
    },
    {
      "document_indices": [
        45
      ],
      "observed_ranks": [
        1
      ],
      "occurrence_count": 1,
      "recommended_track_id": "65fda9a3cc7d1e000a5875d1",
      "seed_track_id": "67a10f7003677edafb63f452"
    },
    {
      "document_indices": [
        45
      ],
      "observed_ranks": [
        3
      ],
      "occurrence_count": 1,
      "recommended_track_id": "6772ffe9d309f299ababaac4",
      "seed_track_id": "67a10f7003677edafb63f452"
    },
    {
      "document_indices": [
        45
      ],
      "observed_ranks": [
        2
      ],
      "occurrence_count": 1,
      "recommended_track_id": "68f66553e8a4cc0a7401c18a",
      "seed_track_id": "67a10f7003677edafb63f452"
    },
    {
      "document_indices": [
        45
      ],
      "observed_ranks": [
        5
      ],
      "occurrence_count": 1,
      "recommended_track_id": "6909196e26bc41a99c8636a3",
      "seed_track_id": "67a10f7003677edafb63f452"
    },
    {
      "document_indices": [
        35
      ],
      "observed_ranks": [
        4
      ],
      "occurrence_count": 1,
      "recommended_track_id": "62b388d6592411a008f52ad5",
      "seed_track_id": "68e3d7a72d873930bbbf7d0c"
    },
    {
      "document_indices": [
        35
      ],
      "observed_ranks": [
        1
      ],
      "occurrence_count": 1,
      "recommended_track_id": "62b38944592411349ff531a7",
      "seed_track_id": "68e3d7a72d873930bbbf7d0c"
    },
    {
      "document_indices": [
        35
      ],
      "observed_ranks": [
        3
      ],
      "occurrence_count": 1,
      "recommended_track_id": "65316386bab2d63bd119e2c2",
      "seed_track_id": "68e3d7a72d873930bbbf7d0c"
    },
    {
      "document_indices": [
        35
      ],
      "observed_ranks": [
        5
      ],
      "occurrence_count": 1,
      "recommended_track_id": "65eb6a4f63853a000a159f50",
      "seed_track_id": "68e3d7a72d873930bbbf7d0c"
    },
    {
      "document_indices": [
        35
      ],
      "observed_ranks": [
        2
      ],
      "occurrence_count": 1,
      "recommended_track_id": "66df03c4edad688793837242",
      "seed_track_id": "68e3d7a72d873930bbbf7d0c"
    }
  ],
  "extraction_provenance": {
    "generator": "recommendations.graph",
    "generator_version": "ave_brainfm_recommendations_1.2.0",
    "sensitive_data_policy": "omit_urls_tokens_cookies_and_session_data"
  },
  "generated_at": "2026-10-19T18:18:51+00:00",
  "list_observations": [
    {
      "document_indices": [
        52
      ],
      "occurrence_count": 1,
      "recommendation_count": 5,
      "recommended_track_ids": [
        "665a227e4dfb90cc19dcd9df",
        "6875503b3b891fead18ab720",
        "62b3841f592411e1bbf4ff22",
        "694059e076a1c1f80ff93a7f",
        "65316386bab2d63bd119e2c2"
      ],
      "seed_track_id": "62b38083592411bbc1f4cc51"
    },
    {
      "document_indices": [
        41
      ],
      "occurrence_count": 1,
      "recommendation_count": 5,
      "recommended_track_ids": [
        "67aa5ba255e93dd3436923e2",
        "665a22614dfb90cc19dcd94e",
        "62b38a78592411cd6df54506",
        "65c690671bf8f200086e0cb7",
        "66918b62de19d0f1c74ea666"
      ],
      "seed_track_id": "62b380ed5924110336f4d7ef"
    },
    {
      "document_indices": [
        48
      ],
      "occurrence_count": 1,
      "recommendation_count": 5,
      "recommended_track_ids": [
        "65eb6a6263853a000a15a02a",
        "66477a0b30b208e2323ed71f",
        "67855b07f76968728486aa62",
        "682b57028ab5a645af4842d4",
        "65b3fafccdef020008e0c12a"
      ],
      "seed_track_id": "62b388df592411d002f52c48"
    },
    {
      "document_indices": [
        45
      ],
      "occurrence_count": 1,
      "recommendation_count": 5,
      "recommended_track_ids": [
        "65fda9a3cc7d1e000a5875d1",
        "68f66553e8a4cc0a7401c18a",
        "6772ffe9d309f299ababaac4",
        "62b38944592411349ff531a7",
        "6909196e26bc41a99c8636a3"
      ],
      "seed_track_id": "67a10f7003677edafb63f452"
    },
    {
      "document_indices": [
        35
      ],
      "occurrence_count": 1,
      "recommendation_count": 5,
      "recommended_track_ids": [
        "62b38944592411349ff531a7",
        "66df03c4edad688793837242",
        "65316386bab2d63bd119e2c2",
        "62b388d6592411a008f52ad5",
        "65eb6a4f63853a000a159f50"
      ],
      "seed_track_id": "68e3d7a72d873930bbbf7d0c"
    }
  ],
  "nodes": [
    {
      "activities": [
        "Recharge"
      ],
      "beats_per_minute_values": [
        120
      ],
      "brightness_levels": [
        0.01
      ],
      "complexity_levels": [
        0.21
      ],
      "declared_duration_seconds_values": [
        900
      ],
      "mental_states": [
        "Relax"
      ],
      "neural_effect_levels": [
        0.05
      ],
      "observed_titles": [
        "Summer Sky"
      ],
      "release_statuses": [
        "published"
      ],
      "styles": [
        "normal"
      ],
      "tags": {
        "activity": [
          "Recharge",
          "Unwind"
        ],
        "genre": [
          "Atmospheric"
        ],
        "instrument": [
          "Textural Soundscape"
        ],
        "mood": [
          "Chill",
          "Dreamlike",
          "Floating",
          "Meditative",
          "Optimistic",
          "Serene"
        ],
        "release": [
          "Desktop Import",
          "Mobile Import"
        ],
        "subgenre": [
          "Ambient"
        ]
      },
      "track_id": "62b38083592411bbc1f4cc51"
    },
    {
      "activities": [
        "Recharge"
      ],
      "beats_per_minute_values": [
        120
      ],
      "brightness_levels": [
        0.16
      ],
      "complexity_levels": [
        0.43
      ],
      "declared_duration_seconds_values": [
        900,
        1800,
        2700,
        3600
      ],
      "mental_states": [
        "Relax"
      ],
      "neural_effect_levels": [
        0.48
      ],
      "observed_titles": [
        "Ancient Voices"
      ],
      "release_statuses": [